{
    "$schema": "../../schemas/player.schema.json",

    "slug": "aim",
    "nickname": "aiM",
    "name": "Mia Cooper",
    "birthday": "2002-04-18",
    "nationalities": ["gb"],
    "tags": ["ninja", "impact"],
    "links": [
        { "name": "ESEA", "url": "https://play.esea.net/users/1626447" },
        { "name": "FACEIT", "url": "https://www.faceit.com/en/players/aiM-" },
        { "name": "HLTV", "url": "https://www.hltv.org/player/23090/aim" },
        { "name": "Instagram", "url": "https://www.instagram.com/mia_cooper_6" },
        { "name": "L.p.", "url": "https://liquipedia.net/counterstrike/AiM" },
        { "name": "Steam", "url": "https://steamcommunity.com/id/aimcs2/" },
        { "name": "Twitch", "url": "https://www.twitch.tv/aimcs_" },
        { "name": "Twitter", "url": "https://x.com/aiMCS2_" },
        { "name": "YouTube", "url": "https://www.youtube.com/@aimcsgo6" }
    ]
}
