{
    "$schema": "../../schemas/player.schema.json",

    "slug": "qiyarah",
    "nickname": "Qiyarah",
    "name": "Kiara Janssen",
    "birthday": "2003-11-05",
    "nationalities": ["nl"],
    "tags": ["twin", "ninja", "impact"],
    "links": [
        { "name": "ESEA", "url": "https://play.esea.net/users/2528275" },
        { "name": "FACEIT", "url": "https://www.faceit.com/en/players/Qiyarah" },
        { "name": "HLTV", "url": "https://www.hltv.org/player/21796/qiyarah" },
        { "name": "Instagram", "url": "https://www.instagram.com/qiyarah.cs" },
        { "name": "L.p.", "url": "https://liquipedia.net/counterstrike/Qiyarah" },
        { "name": "Pinterest", "url": "https://www.pinterest.com/qiyarahgg/" },
        { "name": "Steam", "url": "https://steamcommunity.com/id/Qiyarah/" },
        { "name": "TikTok", "url": "https://www.tiktok.com/@qiyarahcs" },
        { "name": "Twitch", "url": "https://www.twitch.tv/Qiyarah" },
        { "name": "Twitter", "url": "https://x.com/Qiyarahcs" },
        { "name": "YouTube", "url": "https://www.youtube.com/@Qiyarahcs" }
    ]
}
